{
  "schemaVersion": 1,
  "index": 3,
  "slug": "thresholds",
  "theme": "Thresholds",
  "status": "draft",
  "registers": ["awe"],
  "regions": ["global"],
  "eras": ["contemporary"],
  "facets": {
    "person": {
      "key": "person",
      "oneWord": "Crosser",
      "title": "Placeholder Person",
      "body": "This is placeholder content for the Thresholds day, included to prove that the app advances through a sequence of days one at a time. It is not researched or sourced to the editorial charter's standard and should be replaced before this day is shown to a real reader. Real content here would present a single documented human life that embodies the theme of Thresholds, shown with its highs and its lows, in roughly eighty to one hundred and thirty calm, concrete words, with every claim resting on a primary or authoritative secondary source.",
      "sources": [
        {
          "kind": "secondary",
          "title": "Placeholder content, pending research",
          "note": "Structural placeholder to demonstrate day sequencing. Not for publication."
        }
      ]
    },
    "picture": {
      "key": "picture",
      "oneWord": "Doorway",
      "title": "Placeholder Picture",
      "body": "This is placeholder content for the Thresholds day, included to prove that the app advances through a sequence of days one at a time. It is not researched or sourced to the editorial charter's standard and should be replaced before this day is shown to a real reader. Real content here would present a single public domain or Creative Commons visual work and teach the reader how to look at it, in roughly eighty to one hundred and thirty calm, concrete words, with every claim resting on a primary or authoritative secondary source.",
      "sources": [
        {
          "kind": "secondary",
          "title": "Placeholder content, pending research",
          "note": "Structural placeholder to demonstrate day sequencing. Not for publication."
        }
      ],
      "image": {
        "src": "/content/images/placeholder.svg",
        "alt": "A placeholder panel marked Placeholder, standing in for a real public domain artwork.",
        "attribution": "Placeholder image, to be replaced with a properly licensed work.",
        "license": "CC0",
        "sourceUrl": "https://commons.wikimedia.org/"
      }
    },
    "poem": {
      "key": "poem",
      "oneWord": "Between",
      "title": "Placeholder Poem",
      "poet": "To be chosen",
      "body": "This is placeholder content for the Thresholds day, included to prove that the app advances through a sequence of days one at a time. It is not researched or sourced to the editorial charter's standard and should be replaced before this day is shown to a real reader. Real content here would present a single poem, preferably public domain so it can be shown in full, in roughly eighty to one hundred and thirty calm, concrete words, with every claim resting on a primary or authoritative secondary source.",
      "poem": {
        "status": "public-domain",
        "full": "Placeholder poem text.\nA real public domain poem will go here,\nshown in full once this day is researched."
      },
      "sources": [
        {
          "kind": "secondary",
          "title": "Placeholder content, pending research",
          "note": "Structural placeholder to demonstrate day sequencing. Not for publication."
        }
      ]
    },
    "principle": {
      "key": "principle",
      "oneWord": "Liminal",
      "title": "Placeholder Principle",
      "body": "This is placeholder content for the Thresholds day, included to prove that the app advances through a sequence of days one at a time. It is not researched or sourced to the editorial charter's standard and should be replaced before this day is shown to a real reader. Real content here would present the idea at the theme's spine, a concept or mental model, in roughly eighty to one hundred and thirty calm, concrete words, with every claim resting on a primary or authoritative secondary source.",
      "sources": [
        {
          "kind": "secondary",
          "title": "Placeholder content, pending research",
          "note": "Structural placeholder to demonstrate day sequencing. Not for publication."
        }
      ]
    },
    "passage": {
      "key": "passage",
      "oneWord": "Gate",
      "title": "Placeholder Passage",
      "body": "This is placeholder content for the Thresholds day, included to prove that the app advances through a sequence of days one at a time. It is not researched or sourced to the editorial charter's standard and should be replaced before this day is shown to a real reader. Real content here would present a single passage of wisdom, sacred, or literary text from any tradition, in roughly eighty to one hundred and thirty calm, concrete words, with every claim resting on a primary or authoritative secondary source.",
      "sources": [
        {
          "kind": "secondary",
          "title": "Placeholder content, pending research",
          "note": "Structural placeholder to demonstrate day sequencing. Not for publication."
        }
      ]
    },
    "parallel": {
      "key": "parallel",
      "oneWord": "Today",
      "title": "Placeholder Parallel",
      "body": "This is placeholder content for the Thresholds day, included to prove that the app advances through a sequence of days one at a time. It is not researched or sourced to the editorial charter's standard and should be replaced before this day is shown to a real reader. Real content here would present the bridge from history to now, showing how the theme recurs in the present, in roughly eighty to one hundred and thirty calm, concrete words, with every claim resting on a primary or authoritative secondary source.",
      "sources": [
        {
          "kind": "secondary",
          "title": "Placeholder content, pending research",
          "note": "Structural placeholder to demonstrate day sequencing. Not for publication."
        }
      ]
    }
  },
  "resonanceThreads": [
    {
      "facets": ["person", "principle"],
      "note": "Placeholder thread. Real resonance threads must be named before this day could ship."
    }
  ],
  "notes": "Structural placeholder day. Replace all facets with researched, charter-standard content before publication."
}
